{
  "schemaVersion": 1,
  "id": "zgstokenbar.monitor.router",
  "version": "1.0.0",
  "hostApiMajor": 1,
  "hostApiMinMinor": 0,
  "runtime": "builtin",
  "required": false,
  "commandNamespace": "router",
  "capabilities": ["router-monitor", "details"],
  "defaultEnabled": false,
  "order": 50,
  "requires": []
}
