{
  "schemaVersion": 1,
  "id": "zgstokenbar.provider.codex",
  "version": "1.0.0",
  "hostApiMajor": 1,
  "hostApiMinMinor": 0,
  "runtime": "builtin",
  "required": false,
  "commandNamespace": "codex",
  "capabilities": ["quota", "health", "accounts", "settings", "commands", "local-credentials"],
  "defaultEnabled": false,
  "order": 110,
  "requires": []
}
