{
  "schemaVersion": 1,
  "id": "zgstokenbar.metrics.system",
  "version": "1.0.0",
  "hostApiMajor": 1,
  "hostApiMinMinor": 0,
  "runtime": "builtin",
  "required": false,
  "commandNamespace": "system",
  "capabilities": ["system-metrics", "details"],
  "defaultEnabled": true,
  "order": 0,
  "requires": []
}
